{
  "facts": "spec/M2/facts/morph_rollup.extracted.json",
  "facts_sha256": "a38d416cd2247b02acaea6ece27bf562b81e61a45f19d81160173cde894a79c5",
  "ir_version": "holon-ir/0.3",
  "law_id": "L_disch_rev_rollup_228_79cc3e9a",
  "milestone": "M3",
  "notes": "the generalized chain_revert: every action excluded under the blocked condition reverts while it holds (the blocked theorem is the obstruction, whitepaper \u00a78.4); morph_rollup.extracted:revert:rollup_228_79cc3e9a:all",
  "rule": "DISCH",
  "rule_catalog_version": "holon-rules/1.11",
  "statement": {
    "assume": [],
    "binders": [
      {
        "name": "s",
        "q": "forall",
        "type": "Reach"
      },
      {
        "name": "t",
        "q": "forall",
        "type": "Word"
      },
      {
        "name": "a",
        "q": "forall",
        "type": "Act"
      },
      {
        "name": "e",
        "q": "forall",
        "type": "Env"
      },
      {
        "name": "keccak256",
        "q": "forall",
        "type": "Fn<Bytes,Word>"
      }
    ],
    "claim": {
      "eq": [
        {
          "at": {
            "var": "t"
          },
          "disch": "morph_rollup.extracted:revert:rollup_228_79cc3e9a:all",
          "env": {
            "var": "e"
          },
          "from": {
            "var": "s"
          },
          "on": {
            "var": "a"
          }
        },
        {
          "bool": true
        }
      ]
    },
    "scope": {
      "kind": "unbounded"
    }
  },
  "subform": "revert"
}
