{
  "ir_version": "holon-ir/0.3",
  "law_id": "L_orc_dec_exact",
  "milestone": "T12",
  "rule": "FACT",
  "rule_catalog_version": "holon-rules/0.1",
  "facts": "tests_m2/fixtures/oracles/facts/toy_oracle.facts.json",
  "facts_sha256": "",
  "predicted": "REFUTED",
  "notes": "Variant HypD-exact of the pair (L_orc_dec_pad, L_orc_dec_exact): a decoder that only inverts unpadded encodings need not return 1 after post(1). REFUTED (the identity satisfies HypD-exact and returns 9). Split on HypD with L_orc_dec_pad (I12-P2).",
  "statement": {
    "binders": [
      {
        "q": "forall",
        "name": "agg",
        "type": "Fn<List<Nat>,Nat>"
      },
      {
        "q": "forall",
        "name": "dec",
        "type": "Fn<Nat,Nat>"
      }
    ],
    "assume": [
      {
        "hyp": {
          "name": "HypD-exact"
        }
      }
    ],
    "claim": {
      "eq": [
        {
          "obsv": "got_of",
          "of": {
            "step": {
              "act": "post",
              "args": {
                "x": {
                  "nat": 1
                }
              }
            },
            "from": {
              "s0": {}
            }
          }
        },
        {
          "nat": 1
        }
      ]
    },
    "scope": {
      "kind": "unbounded"
    }
  }
}
