{
  "facts": "gen/M3/codec/header_length.json",
  "facts_sha256": "9f7145b09c79a51db45d7481542ca82b763b210acb4c54f96fa2d5529a34b315",
  "ir_version": "holon-ir/0.3",
  "law_id": "L_par_rt_BatchHeaderV1_Bytes_BatchHeaderBytes_SequencerSetVerifyHash_v1",
  "milestone": "M3",
  "notes": "PAR round trip (holon.rules.par): BatchHeaderBytes_SequencerSetVerifyHash inverts BatchHeaderV1_Bytes at version 1 (E1 atom header_length:E1:CODEC.BatchHeaderV1_Bytes:CODEC.BatchHeaderBytes_SequencerSetVerifyHash:1a115b69)",
  "rule": "PAR",
  "rule_catalog_version": "holon-rules/1.7",
  "statement": {
    "assume": [],
    "binders": [
      {
        "name": "h",
        "q": "forall",
        "type": "BatchHeaderV1"
      }
    ],
    "claim": {
      "eq": [
        {
          "args": [
            {
              "args": [
                {
                  "var": "h"
                }
              ],
              "call": "BatchHeaderV1_Bytes"
            }
          ],
          "call": "BatchHeaderBytes_SequencerSetVerifyHash"
        },
        {
          "some": {
            "field": "BatchHeaderV0.SequencerSetVerifyHash",
            "of": {
              "var": "h"
            }
          }
        }
      ]
    },
    "scope": {
      "kind": "unbounded"
    }
  },
  "subform": "round_trip"
}
