{
  "facts": "spec/M2/facts/morph_rollup.extracted.json",
  "facts_sha256": "a38d416cd2247b02acaea6ece27bf562b81e61a45f19d81160173cde894a79c5",
  "ir_version": "holon-ir/0.3",
  "law_id": "L_fact_kernel_Rollup_commitBatchWithProof_committedBatches_blobhash",
  "milestone": "M3",
  "notes": "if calls x1 and x2 of commitBatchWithProof both succeed and commit equal committedBatches values at their write keys, they deliver equal blobhash lists (Thm 6.8 (iii): ker(m) within ker(c), the product program of \u00a78.4), under the premises; fact morph_rollup.extracted:kernel:commitBatchWithProof:committedBatches:blobhash",
  "rule": "FACT",
  "rule_catalog_version": "holon-rules/1.11",
  "statement": {
    "assume": [],
    "binders": [
      {
        "name": "s1",
        "q": "forall",
        "type": "Reach"
      },
      {
        "name": "x1",
        "q": "forall",
        "type": "Act"
      },
      {
        "name": "s2",
        "q": "forall",
        "type": "Reach"
      },
      {
        "name": "x2",
        "q": "forall",
        "type": "Act"
      },
      {
        "name": "keccak256",
        "q": "forall",
        "type": "Fn<Bytes,Word>"
      }
    ],
    "claim": {
      "eq": [
        {
          "fact": "morph_rollup.extracted:kernel:commitBatchWithProof:committedBatches:blobhash",
          "on": [
            {
              "var": "s1"
            },
            {
              "var": "x1"
            },
            {
              "var": "s2"
            },
            {
              "var": "x2"
            },
            {
              "var": "keccak256"
            }
          ]
        },
        {
          "bool": true
        }
      ]
    },
    "scope": {
      "kind": "unbounded"
    }
  },
  "subform": "kernel"
}
