{
  "facts": "gen/M3/codec/header_length.json",
  "facts_sha256": "9f7145b09c79a51db45d7481542ca82b763b210acb4c54f96fa2d5529a34b315",
  "ir_version": "holon-ir/0.3",
  "law_id": "L_par_rt_enc_sol_BatchHeaderBytes_L1MessagePopped_v2",
  "milestone": "M3",
  "notes": "PAR round trip (holon.rules.par): BatchHeaderBytes_L1MessagePopped inverts enc_sol at version 2 (E1 atom header_length:E1:CODEC.enc_sol:CODEC.BatchHeaderBytes_L1MessagePopped:014e9774)",
  "rule": "PAR",
  "rule_catalog_version": "holon-rules/1.7",
  "statement": {
    "assume": [
      {
        "eq": [
          {
            "field": "version",
            "of": {
              "var": "h"
            }
          },
          {
            "bytes": "0x02"
          }
        ]
      }
    ],
    "binders": [
      {
        "name": "h",
        "q": "forall",
        "type": "Header"
      }
    ],
    "claim": {
      "eq": [
        {
          "args": [
            {
              "args": [
                {
                  "var": "h"
                }
              ],
              "call": "enc_sol"
            }
          ],
          "call": "BatchHeaderBytes_L1MessagePopped"
        },
        {
          "some": {
            "field": "l1MessagePopped",
            "of": {
              "var": "h"
            }
          }
        }
      ]
    },
    "scope": {
      "kind": "unbounded"
    }
  },
  "subform": "round_trip"
}
